{
  "schema_version": "1.0.0",
  "observation_id": "obs-incomplete-001",
  "task_id": "task-001",
  "session_id": "session-001",
  "source_instance_id": "src-local-01",
  "lifecycle_state": "incomplete",
  "timing": {
    "started_at": "2026-10-01T02:00:00Z",
    "ended_at": "2026-10-01T02:15:00Z",
    "duration_ms": 900000
  },
  "configuration": {
    "plan": {
      "availability": "available",
      "value": "plus",
      "provenance": "observed"
    },
    "model": {
      "availability": "available",
      "value": "gpt-5.6-sol",
      "provenance": "observed"
    },
    "reasoning_level": {
      "availability": "available",
      "value": "high",
      "provenance": "observed"
    },
    "speed_mode": {
      "availability": "unavailable",
      "provenance": "unavailable"
    },
    "codex_version": {
      "availability": "unavailable",
      "provenance": "unavailable"
    }
  },
  "summary_quality": "D",
  "token_evidence": {
    "status": {
      "validity": "incomplete",
      "quality": "D",
      "reason_codes": [
        "telemetry_incomplete"
      ]
    },
    "raw_token_counters": {
      "uncached_input": {
        "availability": "available",
        "value": 8000,
        "provenance": "observed"
      },
      "cached_input": {
        "availability": "available",
        "value": 2200,
        "provenance": "observed"
      },
      "output": {
        "availability": "available",
        "value": 3100,
        "provenance": "observed"
      },
      "reasoning_output": {
        "availability": "unavailable",
        "provenance": "unavailable"
      },
      "raw_total": {
        "availability": "available",
        "value": 13300,
        "provenance": "derived"
      }
    }
  },
  "quota_evidence": {
    "five_hour": {
      "meter_type": "five_hour",
      "status": {
        "validity": "incomplete",
        "quality": "D",
        "reason_codes": [
          "meter_unstable"
        ]
      },
      "before_sample": {
        "sample_id": "sample-b5",
        "sampled_at": "2026-10-01T02:00:00Z",
        "used_percent": {
          "availability": "available",
          "value": 20,
          "provenance": "observed"
        },
        "remaining_percent": {
          "availability": "available",
          "value": 80,
          "provenance": "observed"
        }
      },
      "after_sample": null,
      "window_identity": {
        "availability": "unavailable"
      },
      "reset_status": "unavailable"
    },
    "weekly": {
      "meter_type": "weekly",
      "status": {
        "validity": "unavailable",
        "quality": "D",
        "reason_codes": [
          "meter_unavailable"
        ]
      },
      "before_sample": null,
      "after_sample": null,
      "window_identity": {
        "availability": "unavailable"
      },
      "reset_status": "unavailable"
    }
  }
}
