{
  "schema_version": "1.0.0",
  "observation_id": "obs:b6ab9686e9907129b519d46c529050000d4a511acb8df81e4c999bace9eb2081",
  "task_id": "task:codex-001",
  "session_id": "session:codex-001",
  "source_instance_id": "src:codex-001",
  "lifecycle_state": "finalized",
  "timing": {
    "started_at": "2026-10-01T02:00:00Z",
    "ended_at": "2026-10-01T02:15:00Z",
    "finalized_at": "2026-10-01T02:20:00Z",
    "duration_ms": 900000
  },
  "configuration": {
    "plan": { "availability": "available", "value": "plus", "provenance": "observed" },
    "model": { "availability": "available", "value": "gpt-5.6-sol", "provenance": "observed" },
    "reasoning_level": { "availability": "available", "value": "high", "provenance": "observed" },
    "speed_mode": { "availability": "unavailable", "provenance": "unavailable" },
    "codex_version": { "availability": "unavailable", "provenance": "unavailable" }
  },
  "summary_quality": "B",
  "token_evidence": {
    "status": { "validity": "valid", "quality": "B", "reason_codes": [] },
    "raw_token_counters": {
      "uncached_input": { "availability": "unavailable", "provenance": "unavailable" },
      "cached_input": { "availability": "available", "value": 2200, "provenance": "derived" },
      "output": { "availability": "available", "value": 3100, "provenance": "derived" },
      "reasoning_output": { "availability": "available", "value": 1200, "provenance": "derived" },
      "raw_total": { "availability": "available", "value": 14500, "provenance": "derived" }
    }
  },
  "quota_evidence": {
    "five_hour": {
      "meter_type": "five_hour",
      "status": { "validity": "valid", "quality": "B", "reason_codes": [] },
      "before_sample": {
        "sample_id": "sample:codex-b5",
        "sampled_at": "2026-10-01T02:00:00Z",
        "used_percent": { "availability": "available", "value": 20, "provenance": "observed" },
        "remaining_percent": { "availability": "available", "value": 80, "provenance": "observed" }
      },
      "after_sample": {
        "sample_id": "sample:codex-a5",
        "sampled_at": "2026-10-01T02:20:00Z",
        "used_percent": { "availability": "available", "value": 24, "provenance": "observed" },
        "remaining_percent": { "availability": "available", "value": 76, "provenance": "observed" }
      },
      "window_identity": { "availability": "available", "meter_type": "five_hour", "observed_reset_at": "2026-10-01T05:00:00Z", "evidence_first_sample_at": "2026-10-01T02:00:00Z", "evidence_last_sample_at": "2026-10-01T02:20:00Z", "identity_provenance": "observed_reset", "identity_confidence": "high" },
      "reset_status": "not_detected",
      "delta_percentage_points": 4
    },
    "weekly": {
      "meter_type": "weekly",
      "status": { "validity": "valid", "quality": "B", "reason_codes": [] },
      "before_sample": {
        "sample_id": "sample:codex-bw",
        "sampled_at": "2026-10-01T02:00:00Z",
        "used_percent": { "availability": "available", "value": 41, "provenance": "observed" },
        "remaining_percent": { "availability": "available", "value": 59, "provenance": "observed" }
      },
      "after_sample": {
        "sample_id": "sample:codex-aw",
        "sampled_at": "2026-10-01T02:20:00Z",
        "used_percent": { "availability": "available", "value": 42, "provenance": "observed" },
        "remaining_percent": { "availability": "available", "value": 58, "provenance": "observed" }
      },
      "window_identity": { "availability": "available", "meter_type": "weekly", "observed_reset_at": "2026-10-06T00:00:00Z", "evidence_first_sample_at": "2026-10-01T02:00:00Z", "evidence_last_sample_at": "2026-10-01T02:20:00Z", "identity_provenance": "observed_reset", "identity_confidence": "high" },
      "reset_status": "not_detected",
      "delta_percentage_points": 1
    }
  }
}
